{
  "schema_version": 4,
  "revision": 0,
  "job": {
    "id": "showcase-de-ch",
    "title": "Innovation, Technologie & Strategie",
    "organization": "",
    "location": "Schweiz | hybrid | remote",
    "source": "ccvl showcase",
    "url": "https://github.com/corbet-labs/ccvl",
    "language": "de-CH",
    "application_date": "September 2026",
    "description": "Aufgaben an der Schnittstelle von Innovationsmanagement, Technologie, Strategie und Finance.",
    "connections": "",
    "company_context": "Target-neutrales, öffentliches Arbeitsbeispiel und offene Bewerbung.",
    "notes": "Der Inhalt beschreibt Julian Corbet; neue Nutzer ersetzen ihn ausschliesslich mit eigenen belegten Fakten.",
    "cl_recipient": {
      "name": "",
      "title": "",
      "company": "",
      "address_line_1": "",
      "address_line_2": ""
    }
  },
  "tailored_cv": {
    "pages": 4,
    "summary": [
      { "text": "Dieses CV ist Arbeitsbeispiel, technische Produktdemo und offene Bewerbung zugleich.", "min_fill": 60, "target_fill": 82, "max_fill": 100 },
      { "text": "Ich verbinde Technologie- und Innovationsmanagement mit Strategie und Finance.", "min_fill": 60, "target_fill": 82, "max_fill": 100 },
      { "text": "Belegt durch GenAI bei CENVION | Entscheidungsanalysen für Swisscom und Airbus.", "min_fill": 60, "target_fill": 82, "max_fill": 100 },
      { "text": "Dazu kommen M&A, Banking und Beratung. Passt das Profil, lassen Sie uns sprechen.", "min_fill": 60, "target_fill": 82, "max_fill": 100 },
      { "text": "Für den eigenen CV: Zielprofil | Differenzierung | zwei belegte Resultate | Mehrwert.", "min_fill": 60, "target_fill": 82, "max_fill": 100 }
    ]
  },
  "tailored_cl": {
    "enabled": true,
    "paragraphs": [
      { "lines": [
        { "text": "Manche Anschreiben beginnen mit Begeisterung für eine Stellenanzeige. Dieses beginnt etwas ehrlicher:", "min_fill": 75, "target_fill": 90, "max_fill": 100 },
        { "text": "Ich suche eine Aufgabe, die Innovationsmanagement und Technologie mit Strategie und Finance verbindet.", "min_fill": 75, "target_fill": 90, "max_fill": 100 },
        { "text": "ccvl zeigt zugleich als Produktdemo, wie ich Bewerbungen strukturiere, messe und belastbar prüfe.", "min_fill": 75, "target_fill": 90, "max_fill": 100 }
      ] },
      { "lines": [
        { "text": "Bei CENVION führte ich Claude und RAG-basierte Suche in Investment- und Reporting-Workflows ein.", "min_fill": 75, "target_fill": 90, "max_fill": 100 },
        { "text": "Für sieben Batteriespeicher modellierte ich IRR, NPV, DSCR und Sensitivitäten; die Analysen stützten", "min_fill": 75, "target_fill": 90, "max_fill": 100 },
        { "text": "Refinanzierungspakete und Entscheidungen institutioneller Investoren. Zugleich automatisierte ich die", "min_fill": 75, "target_fill": 90, "max_fill": 100 },
        { "text": "Datenstrecke von Betriebsdaten bis zu Quartalsberichten und machte Performance-Lücken sowie operative", "min_fill": 75, "target_fill": 90, "max_fill": 100 },
        { "text": "Optimierungshebel sichtbar. Damit verband ich neue Technologie nicht mit einer isolierten Demo, sondern", "min_fill": 75, "target_fill": 90, "max_fill": 100 },
        { "text": "direkt mit Kapitalentscheidungen, Risikotransparenz und einem verlässlicheren Blick auf das Portfolio.", "min_fill": 75, "target_fill": 90, "max_fill": 100 }
      ] },
      { "lines": [
        { "text": "Bei Airbus übersetzte ich 20+ Jahre sicherheitskritische Wartungsdaten von mehr als 500 Flugzeugen in", "min_fill": 75, "target_fill": 90, "max_fill": 100 },
        { "text": "entscheidungsreife Risiko- und Kostensignale. Die Arbeit zeigte über EUR 100'000 jährliches Sparpotenzial", "min_fill": 75, "target_fill": 90, "max_fill": 100 },
        { "text": "und stiess ein internationales Verbesserungsprogramm von über EUR 1 Mio. an. Bei Swisscom modellierte ich", "min_fill": 75, "target_fill": 90, "max_fill": 100 },
        { "text": "Cloud-Ökonomie und Infrastrukturentscheidungen unter Rechenzentrumsgrenzen, unterstützte strategische", "min_fill": 75, "target_fill": 90, "max_fill": 100 },
        { "text": "Investitionen im achtstelligen Bereich und bereitete Lieferantenverhandlungen über CHF 10 Mio. vor.", "min_fill": 75, "target_fill": 90, "max_fill": 100 },
        { "text": "Der rote Faden: technische Komplexität in belastbare und gemeinsam nutzbare Entscheidungen übersetzen.", "min_fill": 75, "target_fill": 90, "max_fill": 100 }
      ] },
      { "lines": [
        { "text": "Das ergibt kein lineares Spezialistenprofil – und genau darin liegt der praktische Mehrwert für ein Team:", "min_fill": 75, "target_fill": 90, "max_fill": 100 },
        { "text": "Ich kann einen Prototypen selbst bauen, seine technische Tragfähigkeit prüfen und zugleich erklären,", "min_fill": 75, "target_fill": 90, "max_fill": 100 },
        { "text": "welches Problem er löst, wie der Business Case aussieht und welche Risiken eine Entscheidung mitbringt.", "min_fill": 75, "target_fill": 90, "max_fill": 100 },
        { "text": "Wo Fachgebiete sonst an Übergaben verlieren, verbinde ich Technologie, Strategie und Finance zu einer", "min_fill": 75, "target_fill": 90, "max_fill": 100 },
        { "text": "gemeinsamen Entscheidungsgrundlage – verständlich für Führungskräfte und belastbar für Fachleute.", "min_fill": 75, "target_fill": 90, "max_fill": 100 }
      ] },
      { "lines": [
        { "text": "Für eine konkrete Bewerbung gehört hier der echte Unternehmensbezug hin: eine Strategie, Initiative oder", "min_fill": 75, "target_fill": 90, "max_fill": 100 },
        { "text": "Aufgabe des Zielunternehmens, die mich nachvollziehbar anspricht – recherchiert statt austauschbar gelobt.", "min_fill": 75, "target_fill": 90, "max_fill": 100 },
        { "text": "Darauf folgt die Brücke von diesem Bedarf zu meiner Erfahrung und ein konkretes Bild meines möglichen", "min_fill": 75, "target_fill": 90, "max_fill": 100 },
        { "text": "Beitrags. Diese öffentliche Version bleibt bewusst offen: Wenn Ihr Team Innovation praktisch umsetzen", "min_fill": 75, "target_fill": 90, "max_fill": 100 },
        { "text": "und wirtschaftlich einordnen will, könnte genau diese Verbindung für beide Seiten interessant sein.", "min_fill": 75, "target_fill": 90, "max_fill": 100 }
      ] },
      { "lines": [
        { "text": "Wenn Sie darin einen möglichen Fit sehen, freue ich mich auf ein offenes Gespräch über Ihre Fragen,", "min_fill": 75, "target_fill": 90, "max_fill": 100 },
        { "text": "meine Erfahrungen und die Aufgaben, bei denen ich Ihrem Team wirklich helfen kann. Vielen Dank für Ihre", "min_fill": 75, "target_fill": 90, "max_fill": 100 },
        { "text": "Zeit und vielleicht bis bald – ich würde mich freuen, Sie und Ihr Unternehmen kennenzulernen.", "min_fill": 75, "target_fill": 90, "max_fill": 100 }
      ] }
    ],
    "highlights": [
      { "text": "Innovation & Technologie | Agentic AI, Cloud-Systeme und 50+ Open-Source-Projekte", "min_fill": 60, "target_fill": 82, "max_fill": 100 },
      { "text": "Applied AI & Data | RAG-Suche, ML-Risikoanalysen und intelligente Automatisierung", "min_fill": 60, "target_fill": 82, "max_fill": 100 },
      { "text": "Strategie & Transformation | SteerCo-Entscheidungen, TOM und operative Umsetzung", "min_fill": 60, "target_fill": 82, "max_fill": 100 },
      { "text": "Finance & Investment | Projektfinanzierung, DCF, Portfolio- und Szenarioanalysen", "min_fill": 60, "target_fill": 82, "max_fill": 100 },
      { "text": "Unternehmerische Umsetzung | Beratung in vier Märkten und Projekt-P&L aus einer Hand", "min_fill": 60, "target_fill": 82, "max_fill": 100 }
    ]
  }
}
