{
  "schema_version": 4,
  "revision": 0,
  "job": {
    "id": "",
    "title": "",
    "organization": "",
    "location": "",
    "source": "",
    "url": "",
    "language": "",
    "application_date": "",
    "description": "",
    "connections": "",
    "company_context": "",
    "notes": "",
    "cl_recipient": {
      "name": "",
      "title": "",
      "company": "",
      "address_line_1": "",
      "address_line_2": ""
    }
  },
  "tailored_cv": {
    "pages": 4,
    "summary": [
      { "text": "", "min_fill": 60, "target_fill": 82, "max_fill": 100 },
      { "text": "", "min_fill": 60, "target_fill": 82, "max_fill": 100 },
      { "text": "", "min_fill": 60, "target_fill": 82, "max_fill": 100 },
      { "text": "", "min_fill": 60, "target_fill": 82, "max_fill": 100 },
      { "text": "", "min_fill": 60, "target_fill": 82, "max_fill": 100 }
    ]
  },
  "tailored_cl": {
    "enabled": true,
    "paragraphs": [
      { "lines": [
        { "text": "", "min_fill": 75, "target_fill": 90, "max_fill": 100 },
        { "text": "", "min_fill": 75, "target_fill": 90, "max_fill": 100 },
        { "text": "", "min_fill": 75, "target_fill": 90, "max_fill": 100 }
      ] },
      { "lines": [
        { "text": "", "min_fill": 75, "target_fill": 90, "max_fill": 100 },
        { "text": "", "min_fill": 75, "target_fill": 90, "max_fill": 100 },
        { "text": "", "min_fill": 75, "target_fill": 90, "max_fill": 100 },
        { "text": "", "min_fill": 75, "target_fill": 90, "max_fill": 100 },
        { "text": "", "min_fill": 75, "target_fill": 90, "max_fill": 100 },
        { "text": "", "min_fill": 75, "target_fill": 90, "max_fill": 100 }
      ] },
      { "lines": [
        { "text": "", "min_fill": 75, "target_fill": 90, "max_fill": 100 },
        { "text": "", "min_fill": 75, "target_fill": 90, "max_fill": 100 },
        { "text": "", "min_fill": 75, "target_fill": 90, "max_fill": 100 },
        { "text": "", "min_fill": 75, "target_fill": 90, "max_fill": 100 },
        { "text": "", "min_fill": 75, "target_fill": 90, "max_fill": 100 },
        { "text": "", "min_fill": 75, "target_fill": 90, "max_fill": 100 }
      ] },
      { "lines": [
        { "text": "", "min_fill": 75, "target_fill": 90, "max_fill": 100 },
        { "text": "", "min_fill": 75, "target_fill": 90, "max_fill": 100 },
        { "text": "", "min_fill": 75, "target_fill": 90, "max_fill": 100 },
        { "text": "", "min_fill": 75, "target_fill": 90, "max_fill": 100 },
        { "text": "", "min_fill": 75, "target_fill": 90, "max_fill": 100 }
      ] },
      { "lines": [
        { "text": "", "min_fill": 75, "target_fill": 90, "max_fill": 100 },
        { "text": "", "min_fill": 75, "target_fill": 90, "max_fill": 100 },
        { "text": "", "min_fill": 75, "target_fill": 90, "max_fill": 100 },
        { "text": "", "min_fill": 75, "target_fill": 90, "max_fill": 100 },
        { "text": "", "min_fill": 75, "target_fill": 90, "max_fill": 100 }
      ] },
      { "lines": [
        { "text": "", "min_fill": 75, "target_fill": 90, "max_fill": 100 },
        { "text": "", "min_fill": 75, "target_fill": 90, "max_fill": 100 },
        { "text": "", "min_fill": 75, "target_fill": 90, "max_fill": 100 }
      ] }
    ],
    "highlights": [
      { "text": "", "min_fill": 60, "target_fill": 82, "max_fill": 100 },
      { "text": "", "min_fill": 60, "target_fill": 82, "max_fill": 100 },
      { "text": "", "min_fill": 60, "target_fill": 82, "max_fill": 100 },
      { "text": "", "min_fill": 60, "target_fill": 82, "max_fill": 100 },
      { "text": "", "min_fill": 60, "target_fill": 82, "max_fill": 100 }
    ]
  }
}
