{
  "schema_version": 4,
  "revision": 0,
  "job": {
    "id": "showcase-en-ch",
    "title": "Innovation, Technology & Strategy",
    "organization": "",
    "location": "Switzerland | hybrid | remote",
    "source": "ccvl showcase",
    "url": "https://github.com/corbet-labs/ccvl",
    "language": "en-CH",
    "application_date": "September 2026",
    "description": "Roles at the intersection of innovation management, technology, strategy and finance.",
    "connections": "",
    "company_context": "Target-neutral public working example and open application.",
    "notes": "The content describes Julian Corbet; new users replace it only with their own evidenced facts.",
    "cl_recipient": {
      "name": "",
      "title": "",
      "company": "",
      "address_line_1": "",
      "address_line_2": ""
    }
  },
  "tailored_cv": {
    "pages": 4,
    "summary": [
      { "text": "This CV is a working example, technical product demonstration and open application.", "min_fill": 60, "target_fill": 82, "max_fill": 100 },
      { "text": "I combine technology and innovation management with strategy and finance.", "min_fill": 60, "target_fill": 82, "max_fill": 100 },
      { "text": "Evidence: GenAI at CENVION | decision analysis for Swisscom and Airbus.", "min_fill": 60, "target_fill": 82, "max_fill": 100 },
      { "text": "I also bring M&A, banking and consulting experience. If that fits, let's talk.", "min_fill": 60, "target_fill": 82, "max_fill": 100 },
      { "text": "To adapt it: target profile | differentiation | two evidenced results | value offered.", "min_fill": 60, "target_fill": 82, "max_fill": 100 }
    ]
  },
  "tailored_cl": {
    "enabled": true,
    "paragraphs": [
      { "lines": [
        { "text": "Some cover letters begin with enthusiasm for a particular vacancy. This one begins deliberately more honestly:", "min_fill": 75, "target_fill": 90, "max_fill": 100 },
        { "text": "I am looking for a role connecting innovation management and technology with strategy and finance.", "min_fill": 75, "target_fill": 90, "max_fill": 100 },
        { "text": "ccvl also serves as a product demo of how I structure, measure and rigorously review applications.", "min_fill": 75, "target_fill": 90, "max_fill": 100 }
      ] },
      { "lines": [
        { "text": "At CENVION, I introduced Claude and RAG-based search into investment and reporting workflows.", "min_fill": 75, "target_fill": 90, "max_fill": 100 },
        { "text": "For seven battery-storage assets, I modelled IRR, NPV, DSCR and sensitivities; the analysis supported", "min_fill": 75, "target_fill": 90, "max_fill": 100 },
        { "text": "refinancing packages and decisions for institutional investors. I also automated the data flow from", "min_fill": 75, "target_fill": 90, "max_fill": 100 },
        { "text": "operating data to quarterly reports, making performance gaps and operational improvement levers visible.", "min_fill": 75, "target_fill": 90, "max_fill": 100 },
        { "text": "That connected emerging technology not to an isolated demonstration, but directly to capital decisions,", "min_fill": 75, "target_fill": 90, "max_fill": 100 },
        { "text": "risk transparency, portfolio priorities and a more dependable view of operational performance.", "min_fill": 75, "target_fill": 90, "max_fill": 100 }
      ] },
      { "lines": [
        { "text": "At Airbus, I translated 20+ years of safety-critical maintenance data across more than 500 aircraft into", "min_fill": 75, "target_fill": 90, "max_fill": 100 },
        { "text": "decision-ready risk and cost signals. The work surfaced EUR 100k+ in annual savings potential and helped", "min_fill": 75, "target_fill": 90, "max_fill": 100 },
        { "text": "trigger an international improvement programme worth more than EUR 1m. At Swisscom, I then modelled", "min_fill": 75, "target_fill": 90, "max_fill": 100 },
        { "text": "cloud economics and infrastructure choices under data-centre constraints, supported strategic", "min_fill": 75, "target_fill": 90, "max_fill": 100 },
        { "text": "eight-figure investments and supplier negotiations exceeding CHF 10m for infrastructure programmes.", "min_fill": 75, "target_fill": 90, "max_fill": 100 },
        { "text": "The recurring pattern is turning technical complexity into evidence specialists and leaders can use together.", "min_fill": 75, "target_fill": 90, "max_fill": 100 }
      ] },
      { "lines": [
        { "text": "This is not a linear specialist profile – and that is precisely where its practical value lies for a team:", "min_fill": 75, "target_fill": 90, "max_fill": 100 },
        { "text": "I can build a prototype myself, test its technical viability and explain the problem it solves at the same time.", "min_fill": 75, "target_fill": 90, "max_fill": 100 },
        { "text": "I connect that understanding to the business case, decision risks and the route from an idea into delivery.", "min_fill": 75, "target_fill": 90, "max_fill": 100 },
        { "text": "Where disciplines otherwise lose momentum at handovers, I join technology, strategy and finance into one", "min_fill": 75, "target_fill": 90, "max_fill": 100 },
        { "text": "decision base that remains accessible to leaders and credible to the specialists responsible for execution.", "min_fill": 75, "target_fill": 90, "max_fill": 100 }
      ] },
      { "lines": [
        { "text": "For a real application, this is where specific company fit belongs: a strategy, initiative or challenge", "min_fill": 75, "target_fill": 90, "max_fill": 100 },
        { "text": "that genuinely attracts me – researched and understood rather than praised with interchangeable language.", "min_fill": 75, "target_fill": 90, "max_fill": 100 },
        { "text": "It then connects that need to my experience and offers a concrete picture of the contribution I could make.", "min_fill": 75, "target_fill": 90, "max_fill": 100 },
        { "text": "This public version remains deliberately open: if your team wants to implement innovation hands-on and", "min_fill": 75, "target_fill": 90, "max_fill": 100 },
        { "text": "translate it into commercial decisions, that combination may be worth exploring together.", "min_fill": 75, "target_fill": 90, "max_fill": 100 }
      ] },
      { "lines": [
        { "text": "If you see a possible fit, I would welcome an open conversation about your questions, my experience and", "min_fill": 75, "target_fill": 90, "max_fill": 100 },
        { "text": "the work where I could genuinely help your team. Thank you for taking the time to consider this unusual", "min_fill": 75, "target_fill": 90, "max_fill": 100 },
        { "text": "open application – I would be glad to learn more about you, your organisation and the problems ahead.", "min_fill": 75, "target_fill": 90, "max_fill": 100 }
      ] }
    ],
    "highlights": [
      { "text": "Innovation & Technology | Agentic AI, cloud systems and 50+ open-source projects", "min_fill": 60, "target_fill": 82, "max_fill": 100 },
      { "text": "Applied AI & Data | RAG search, ML risk analysis and intelligent automation", "min_fill": 60, "target_fill": 82, "max_fill": 100 },
      { "text": "Strategy & Transformation | SteerCo decisions, TOM and operational delivery", "min_fill": 60, "target_fill": 82, "max_fill": 100 },
      { "text": "Finance & Investment | Project finance, DCF, portfolio and scenario analysis", "min_fill": 60, "target_fill": 82, "max_fill": 100 },
      { "text": "Entrepreneurial Delivery | Consulting across four markets and end-to-end project P&L", "min_fill": 60, "target_fill": 82, "max_fill": 100 }
    ]
  }
}
